{
  "$schema": "https://json-schema.org/draft/2020-12/schema",
  "title": "debate_critique_packet",
  "type": "object",
  "additionalProperties": false,
  "properties": {
    "packet_id": {
      "type": "string"
    },
    "route_id": {
      "type": "string"
    },
    "producer_component_id": {
      "type": "string"
    },
    "consumer_component_ids": {
      "type": "array",
      "items": {
        "type": "string"
      }
    },
    "lineage": {
      "type": "object"
    },
    "validation_status": {
      "type": "string"
    },
    "critique_points": {
      "type": "array",
      "items": {
        "type": "string"
      }
    },
    "line_refs": {
      "type": "array",
      "items": {
        "type": "string"
      }
    }
  },
  "required": [
    "packet_id",
    "route_id",
    "producer_component_id",
    "consumer_component_ids",
    "lineage",
    "validation_status",
    "critique_points",
    "line_refs"
  ]
}